{
  "id": "00000000-0000-4000-8000-000000000001",
  "run_id": "00000000-0000-4000-8000-000000000001",
  "node_id": "analyze",
  "attempt": 0,
  "input_hash": "0000000000000000000000000000000000000000000000000000000000000000",
  "output_refs": [],
  "idempotency_receipts": [],
  "fencing_token": "1",
  "cancel_epoch": "0",
  "config_versions": {
    "template_version": "1.0.0",
    "schema_version": "1.0.0",
    "prompt_version": "1.0.0",
    "ruleset_version": "1.0.0",
    "model_version_id": null
  },
  "last_event_sequence": "1",
  "created_at": "2026-10-03T00:00:00Z"
}
